{"protocol_version":"runtime-v3-gameplay","schema_digest":"03816c3ef8bdba036dd65dd1063bfaf1128cb331f4d0e9267b378c54bf5a1959","provenance":{"artifact":"sts2-protocol/runtime-v3-gameplay","source":"schemas/runtime-v3-gameplay.schema.json","generator":"hand-authored"},"correlation_id":"corr-1","instance_id":"instance-1","session_id":"session-1","lease_id":"lease-1","lease_epoch":1,"generation":0,"kind":"state_request","state_id":null,"operation_id":null,"observation":null,"legal_actions":null,"action":null,"status":null,"transition":null,"error_code":null,"wait_for_millis":null,"wait_outcome":null,"recovery":null}
