{"protocol_version":"runtime-v3-gameplay","schema_digest":"03816c3ef8bdba036dd65dd1063bfaf1128cb331f4d0e9267b378c54bf5a1959","provenance":{"artifact":"sts2-protocol/runtime-v3-gameplay","source":"schemas/runtime-v3-gameplay.schema.json","generator":"hand-authored"},"correlation_id":"corr-3","instance_id":"instance-1","session_id":"session-1","lease_id":"lease-1","lease_epoch":1,"generation":0,"kind":"state_response","state_id":"combat-2","operation_id":null,"observation":{"state_id":"combat-2","generation":0,"visible_seed":"visible-seed-1","player":{"hp":50,"max_hp":50,"energy":2,"gold":99,"hand":[{"card_id":"card:31:Blood-Wall","name":"Blood Wall","cost":2,"upgraded":true,"description":"Gain 8 Block."}],"deck":[],"discard":[],"exhaust":[],"relics":[{"relic_id":"relic:1:Blood-Vial","name":"Blood Vial","description":"Heal 2 HP at the end of each turn."},{"relic_id":"relic:2:Anchor","name":"Anchor"}],"potions":[{"potion_id":"potion:1:Fire","name":"Fire Potion","slot":0,"usable":true,"target_mode":"any_enemy","description":"Deal 20 damage to one enemy."},{"potion_id":"potion:2:Block","name":"Block Potion","slot":1,"usable":false,"target_mode":"self","description":"Gain 12 Block."},{"potion_id":"potion:3:Unknown","name":"Murky Draught","target_mode":"unknown"}],"potion_slots":3,"max_potion_slots":3},"state":{"state":"combat","turn_index":3,"enemies":[{"enemy_id":"enemy-1","name":"Hexling","hp":20,"max_hp":24,"intent":{"kind":"attack","damage":9,"hits":1}}]}},"legal_actions":[{"action_id":"card.play.blood_wall","action":{"kind":"play_card","card_id":"card:31:Blood-Wall","target_id":null}},{"action_id":"potion.use.fire","action":{"kind":"use_potion","potion_id":"potion:1:Fire","target_id":"enemy-1"}},{"action_id":"potion.discard.murky","action":{"kind":"discard_potion","potion_id":"potion:3:Unknown"}}],"action":null,"status":null,"transition":null,"error_code":null,"wait_for_millis":null,"wait_outcome":null,"recovery":null}
