{"protocol_version":"runtime-v3-gameplay","schema_digest":"03816c3ef8bdba036dd65dd1063bfaf1128cb331f4d0e9267b378c54bf5a1959","provenance":{"artifact":"sts2-protocol/runtime-v3-gameplay","source":"schemas/runtime-v3-gameplay.schema.json","generator":"hand-authored"},"correlation_id":"corr-2","instance_id":"instance-1","session_id":"session-1","lease_id":"lease-1","lease_epoch":1,"generation":0,"kind":"state_response","state_id":"reward-1","operation_id":null,"observation":{"state_id":"reward-1","generation":0,"visible_seed":"visible-seed-1","player":{"hp":50,"max_hp":50,"energy":3,"gold":99,"hand":[],"deck":[],"discard":[],"exhaust":[]},"state":{"state":"reward","options":["card:21:Setup-Strike",{"choice_id":"card:22:Tremble","name":"Tremble","cost":1,"rarity":"uncommon","description":"Deal 3 damage to all enemies.","contents":["card:23:Blood-Wall",{"choice_id":"card:24:Block","name":"Block","cost":2}]},{"choice_id":"card:25:Blood-Wall-Upgraded","upgraded":true}]}},"legal_actions":[{"action_id":"reward.take","action":{"kind":"select_card","card_id":"card:22:Tremble"}}],"action":null,"status":null,"transition":null,"error_code":null,"wait_for_millis":null,"wait_outcome":null,"recovery":null}
